{
  "schema_version": "1.0.0",
  "project": {
    "name": "Tourify Music Rights Passport — Phase 2",
    "repository_root": "/Users/kyledaley/Developer/myproject/tourify-beta-K2",
    "branch": "codex/live-sync-dashboard-news",
    "base_commit": "673b82984da5670b94ed68d1efd94130539ea859",
    "current_commit": "673b82984da5670b94ed68d1efd94130539ea859",
    "overall_status": "in_progress",
    "updated_at": "2026-07-17T23:29:15.875Z",
    "notes": "Phase 2 P0/P1 implemented behind flags. Remaining blockers: remote migration apply, counsel, Sepolia keys, live pilot."
  },
  "audit": {
    "status": "complete",
    "report_path": "docs/music-trust/phase-2/CURRENT_STATE_AUDIT_RESULTS.md",
    "baseline_commands": [
      {
        "name": "Dependencies",
        "command": "node -v && npm -v",
        "status": "passed",
        "result": "Node v20.19.0, npm 11.5.2"
      },
      {
        "name": "Lint",
        "command": "npm run lint",
        "status": "deferred",
        "result": "Deferred on dirty worktree; record after implementation slices"
      },
      {
        "name": "Typecheck",
        "command": "npm run typecheck",
        "status": "deferred",
        "result": "Deferred full run; Phase 1 audit previously passed"
      },
      {
        "name": "Unit tests",
        "command": "npx jest lib/music/__tests__/music-trust-phase1.test.ts lib/music/__tests__/music-public-verification.test.ts --no-coverage",
        "status": "passed",
        "result": "13 passed"
      },
      {
        "name": "Integration tests",
        "command": "n/a",
        "status": "not_started",
        "result": "Rights route tests to be added in P2-B+"
      },
      {
        "name": "Build",
        "command": "npm run build",
        "status": "deferred",
        "result": "Deferred until hardening"
      },
      {
        "name": "Migration status",
        "command": "ls supabase/migrations/*music*",
        "status": "passed",
        "result": "Phase 1 migrations present; Phase 2 none at audit"
      },
      {
        "name": "Supabase advisors",
        "command": "remote advisors",
        "status": "blocked",
        "result": "No remote mutation authorized"
      }
    ],
    "findings": [
      {
        "id": "F-001",
        "severity": "info",
        "summary": "artist_music.id is UUID; sound recording FK must be uuid"
      },
      {
        "id": "F-002",
        "severity": "info",
        "summary": "Phase 1 trust/cert stack exists and is flag-gated off by default"
      },
      {
        "id": "F-003",
        "severity": "warning",
        "summary": "No general outbox; Phase 2 must add music_rights_outbox_events"
      },
      {
        "id": "F-004",
        "severity": "warning",
        "summary": "Artist music APIs are owner-scoped; contributor access must be added"
      },
      {
        "id": "F-005",
        "severity": "info",
        "summary": "E-sign is first-party clickwrap only; no DocuSign"
      },
      {
        "id": "F-006",
        "severity": "info",
        "summary": "No music_rights_* tables, C2PA, watermark, or blockchain code present"
      }
    ],
    "blockers": [
      {
        "id": "B-001",
        "summary": "Remote advisors/production migration unauthorized",
        "safe_state": "local additive migrations; flags off",
        "unblocking": "ops authorization"
      },
      {
        "id": "B-002",
        "summary": "Sepolia deployer keys may be absent",
        "safe_state": "flag off; passport valid without anchor",
        "unblocking": "provide keys"
      },
      {
        "id": "B-003",
        "summary": "Legal counsel sign-off pending",
        "safe_state": "conservative public copy; flags off",
        "unblocking": "counsel approval"
      }
    ]
  },
  "architecture_decisions": [
    {
      "id": "ADR-P2-001",
      "title": "Rights schema and naming",
      "status": "accepted",
      "decision": "Use public schema with music_rights_* table prefix matching Phase 1 music_* conventions.",
      "evidence": [
        "docs/music-trust/phase-2/CURRENT_STATE_AUDIT_RESULTS.md"
      ]
    },
    {
      "id": "ADR-P2-002",
      "title": "Track-to-recording cardinality",
      "status": "accepted",
      "decision": "One primary music_rights_sound_recordings row per artist_music (artist_music_id uuid unique); special relationships via music_rights_asset_relationships.",
      "evidence": [
        "docs/music-trust/phase-2/CURRENT_STATE_AUDIT_RESULTS.md"
      ]
    },
    {
      "id": "ADR-P2-003",
      "title": "Electronic signature provider",
      "status": "accepted",
      "decision": "First-party Tourify e-sign ceremony extending agreement.service clickwrap with reauth, claim snapshots, and sealed private copies. No third-party vendor in Phase 2.",
      "evidence": [
        "docs/music-trust/phase-2/CURRENT_STATE_AUDIT_RESULTS.md"
      ]
    },
    {
      "id": "ADR-P2-004",
      "title": "Credential format and signing suite",
      "status": "accepted",
      "decision": "W3C VC 2.0-compatible JSON envelope; Ed25519 issuer key from server env; DB credential status list.",
      "evidence": [
        "docs/music-trust/phase-2/CURRENT_STATE_AUDIT_RESULTS.md"
      ]
    },
    {
      "id": "ADR-P2-005",
      "title": "C2PA audio toolchain and format matrix",
      "status": "accepted",
      "decision": "C2PA adapter + async worker; WAV embedded + MP3 sidecar; lazy SDK; failure leaves clean master untouched.",
      "evidence": [
        "docs/music-trust/phase-2/CURRENT_STATE_AUDIT_RESULTS.md"
      ]
    },
    {
      "id": "ADR-P2-006",
      "title": "Watermark and monitoring adapters",
      "status": "accepted",
      "decision": "Watermark adapter interface with noop + opt-in beta_stub; monitoring matches require human review.",
      "evidence": [
        "docs/music-trust/phase-2/CURRENT_STATE_AUDIT_RESULTS.md"
      ]
    },
    {
      "id": "ADR-P2-007",
      "title": "Testnet and attestation registry",
      "status": "accepted",
      "decision": "EVM Sepolia testnet; immutable V1 OpenZeppelin AccessControl registry; mainnet disabled; off-chain passport remains valid if anchor pending/failed.",
      "evidence": [
        "docs/music-trust/phase-2/CURRENT_STATE_AUDIT_RESULTS.md"
      ]
    },
    {
      "id": "ADR-P2-008",
      "title": "Key management and rotation",
      "status": "accepted",
      "decision": "Dev/test env secrets; prod KMS/HSM runbook; separate issuer/C2PA/chain keys; never client-exposed.",
      "evidence": [
        "docs/music-trust/phase-2/CURRENT_STATE_AUDIT_RESULTS.md"
      ]
    },
    {
      "id": "ADR-P2-009",
      "title": "Evidence retention and deletion",
      "status": "accepted",
      "decision": "Private buckets music-rights-evidence, music-rights-documents, music-rights-exports; append-only audit/signature events; retain until owner delete subject to legal hold.",
      "evidence": [
        "docs/music-trust/phase-2/CURRENT_STATE_AUDIT_RESULTS.md"
      ]
    },
    {
      "id": "ADR-P2-010",
      "title": "DDEX target standards and versions",
      "status": "accepted",
      "decision": "DDEX-aligned identifier fields (ISRC/ISWC/UPC concepts); no full ERN/MWDR export automation in Phase 2.",
      "evidence": [
        "docs/music-trust/phase-2/CURRENT_STATE_AUDIT_RESULTS.md"
      ]
    }
  ],
  "feature_flags": [
    {
      "name": "music_rights_workspace_enabled",
      "default_state": "disabled",
      "purpose": "Enable artist rights workspace."
    },
    {
      "name": "music_catalog_import_enabled",
      "default_state": "disabled",
      "purpose": "Enable existing catalog import."
    },
    {
      "name": "music_contributor_workflows_enabled",
      "default_state": "disabled",
      "purpose": "Enable invitations, claims, and confirmations."
    },
    {
      "name": "music_agreements_enabled",
      "default_state": "disabled",
      "purpose": "Enable agreement generation and signing."
    },
    {
      "name": "music_human_origin_v2_enabled",
      "default_state": "disabled",
      "purpose": "Enable full evidence-based Human-Origin review."
    },
    {
      "name": "music_rights_passport_enabled",
      "default_state": "disabled",
      "purpose": "Enable passport issuance."
    },
    {
      "name": "music_public_passport_verification_enabled",
      "default_state": "disabled",
      "purpose": "Enable narrow public verification."
    },
    {
      "name": "music_c2pa_derivatives_enabled",
      "default_state": "disabled",
      "purpose": "Enable C2PA protected derivatives."
    },
    {
      "name": "music_watermark_beta_enabled",
      "default_state": "disabled",
      "purpose": "Enable opt-in forensic watermark beta."
    },
    {
      "name": "music_training_reservation_enabled",
      "default_state": "disabled",
      "purpose": "Publish asset-level training reservation."
    },
    {
      "name": "music_testnet_anchor_enabled",
      "default_state": "disabled",
      "purpose": "Enable testnet attestation anchors."
    },
    {
      "name": "music_rights_ops_enabled",
      "default_state": "disabled",
      "purpose": "Enable rights operations queues and controls."
    }
  ],
  "phases": [
    {
      "id": "P2-A",
      "name": "Audit and architecture decisions",
      "order": 0,
      "status": "complete",
      "objective": "Verify Phase 1 and select actual Phase 2 architecture.",
      "task_ids": [
        "P2-A-001",
        "P2-A-002",
        "P2-A-003",
        "P2-A-004",
        "P2-A-005",
        "P2-A-006",
        "P2-A-007",
        "P2-A-008",
        "P2-A-009",
        "P2-A-010",
        "P2-A-011"
      ],
      "entry_criteria": [
        "Prior phase gates are complete or explicitly blocked with safe-state evidence."
      ],
      "exit_criteria": [
        "All P0/P1 tasks meet acceptance criteria and required tests are recorded."
      ],
      "gate_results": [
        {